<?xml version="1.0" encoding="UTF-8"?>
<!-- A comment in the file kompisar.xml -->
<ivan:kompisRelation
        xmlns:ivan="http://www.ivan.com/schemas"
        xmlns:xsi="http://www.w3.org/2001/XMLSchema-instance"
        xsi:schemaLocation="http://www.ivan.com/schemas kompisSchema.xsd"
        degree="closeFriends">
    <person>
        <firstName>Ivan</firstName>
        <lastName>Krizsan</lastName>
        <age>19</age>
    </person>
    <friend ivan:eyeColour="green">
        <firstName>Steven</firstName>
        <lastName>Segal</lastName>
        <age>49</age>
    </friend>
    <friend>
        <firstName>Carl-Gustav</firstName>
        <lastName>Svensson</lastName>
        <age>56</age>
    </friend>
    <!-- There is a deliberate error here. -->
    <friend hasDog="true">
    </friend>
</ivan:kompisRelation>